text,category
"Projeto Alfa - Revisão Semanal: Discutimos o progresso do Projeto Alfa, focando nas tarefas da sprint atual. A equipe de desenvolvimento reportou a conclusão do módulo de autenticação, mas identificou um bloqueio na integração com a API de terceiros. Avaliamos o impacto no cronograma geral, que parece mínimo por ora. Definimos que a equipe de backend investigará a API como prioridade e apresentará uma solução até quarta-feira. O gerente de projeto atualizará o status no JIRA.","Atualizações de Projeto"
"Projeto Ômega - Marco Fase 1: A reunião celebrou a conclusão bem-sucedida da Fase 1 do Projeto Ômega. Revisamos os entregáveis e confirmamos que todos os critérios de aceitação foram atendidos. Discutimos as lições aprendidas, destacando a boa comunicação inter-equipes. O planejamento para a Fase 2 foi iniciado, com foco na definição detalhada dos requisitos de front-end. A próxima reunião será dedicada a refinar o escopo da Fase 2.","Atualizações de Projeto"
"Projeto Beta - Alinhamento Sprint: Realizamos o alinhamento das próximas tarefas e responsáveis para a nova sprint do Projeto Beta. O Product Owner apresentou as prioridades, com ênfase na funcionalidade de relatórios customizáveis. A equipe estimou o esforço para cada item do backlog selecionado. Houve debate sobre a complexidade de uma das tarefas, decidindo-se por dividi-la em duas menores. As atribuições foram confirmadas e registradas na ferramenta de gestão.","Atualizações de Projeto"
"Sistema Gênesis - Demo Módulo Login: A equipe de desenvolvimento apresentou uma demonstração funcional do módulo de login do Sistema Gênesis. O fluxo de cadastro, login e recuperação de senha foi exibido. O feedback inicial dos stakeholders foi positivo, com sugestões menores de ajuste na interface do usuário (cores e texto). Acordamos que essas sugestões serão incorporadas e uma nova revisão ocorrerá na próxima semana. A documentação técnica associada também foi disponibilizada.","Atualizações de Projeto"
"Projeto Fênix - Bloqueadores API: Focamos especificamente nos bloqueadores encontrados na integração da API do Projeto Fênix. A equipe técnica detalhou os problemas de compatibilidade de versão e a falta de documentação clara do fornecedor. Brainstormamos possíveis soluções, incluindo a criação de um middleware ou a busca por uma API alternativa. Decidiu-se contactar o suporte técnico do fornecedor urgentemente e, paralelamente, pesquisar alternativas viáveis. O prazo para decisão é sexta-feira.","Atualizações de Projeto"
"Produto Delta - Marcos Lançamento: Definimos os marcos principais para o lançamento do Produto Delta no próximo trimestre (Q4). Estabelecemos datas chave para conclusão do desenvolvimento, fase de testes (Alfa e Beta), preparação de material de marketing e treinamento da equipe de vendas. Foi criado um cronograma visual (Gantt) compartilhado com todos os envolvidos. Revisaremos o progresso em relação a esses marcos quinzenalmente. Há uma preocupação sobre a disponibilidade da equipe de QA em Novembro.","Atualizações de Projeto"
"Projeto Sigma - Análise de Riscos: Conduzimos uma sessão de análise de riscos e planejamento de mitigação para a implantação do Projeto Sigma. Identificamos riscos técnicos (compatibilidade de infraestrutura), de processo (adoção pelos usuários) e de recursos (disponibilidade da equipe chave). Para cada risco, avaliamos probabilidade e impacto, e definimos ações preventivas e corretivas. O registro de riscos foi atualizado e será monitorado semanalmente pelo gerente de projeto.","Atualizações de Projeto"
"Projeto Kapa - Revisão Cronograma: Revisamos o cronograma atualizado do Projeto Kapa após o atraso na entrega de um componente essencial pelo fornecedor. Analisamos os potenciais impactos nas fases subsequentes e no prazo final. Discutimos opções para acelerar outras tarefas, como trabalho em paralelo e horas extras pontuais. Foi decidido tentar absorver o atraso sem alterar a data final, mas monitorando de perto. Uma reavaliação será feita em duas semanas.","Atualizações de Projeto"
"App Móvel Lambda - Feedback Protótipo: A equipe de UX apresentou o protótipo navegável do aplicativo móvel do Projeto Lambda. Coletamos feedback detalhado dos stakeholders sobre o fluxo de navegação, design visual e usabilidade geral. As principais sugestões incluíram simplificar a tela de configurações e adicionar um tutorial inicial. A equipe de UX consolidará o feedback e apresentará uma versão revisada do protótipo na próxima reunião de design.","Atualizações de Projeto"
"Projeto Tau - Acompanhamento Pendências: Reunião dedicada ao acompanhamento das pendências da última atualização sobre o Projeto Tau. Verificamos o status de cada item de ação atribuído na reunião anterior. A maioria foi concluída, mas a definição da estratégia de migração de dados ainda está pendente devido à análise de volume. O responsável pela tarefa se comprometeu a apresentar a análise finalizada até amanhã. Revisamos também o burn down chart da sprint.","Atualizações de Projeto"
"Projeto Zeta - Alocação Recursos: Discutimos a necessidade de alocação de recursos adicionais para acelerar o Projeto Zeta, que está atrás do cronograma. Analisamos as opções, incluindo trazer um desenvolvedor de outra equipe temporariamente ou contratar um freelancer. Avaliamos o impacto no orçamento e o tempo necessário para integração do novo membro. Decidimos aprovar a contratação de um freelancer especializado em backend por 3 meses, iniciando o processo imediatamente.","Atualizações de Projeto"
"Projeto Épsilon - Validação Documentação: O objetivo foi validar a documentação técnica finalizada para o Projeto Épsilon antes de enviá-la para a equipe de QA. Revisamos os diagramas de arquitetura, especificações de API e manuais de configuração. Identificamos algumas seções que precisavam de maior clareza e exemplos práticos. A equipe técnica fará os ajustes solicitados até o final do dia. A documentação foi considerada robusta no geral.","Atualizações de Projeto"
"Projeto Gama - Planejamento Testes: Planejamos as atividades de teste para a nova funcionalidade de agendamento do Projeto Gama. Definimos os tipos de teste a serem executados (funcional, usabilidade, performance, segurança). Esboçamos os principais cenários de teste e atribuímos a criação dos casos de teste detalhados à equipe de QA. Estimamos o tempo necessário para a execução dos testes e definimos a janela no cronograma do projeto.","Atualizações de Projeto"
"Projeto Iota - Relatório Progresso Stakeholders: Apresentamos o relatório de progresso semanal do Projeto Iota aos principais stakeholders. Destacamos os avanços na integração do sistema de pagamentos e a conclusão dos testes unitários do módulo X. Respondemos a perguntas sobre o gerenciamento de riscos e o orçamento. Os stakeholders expressaram satisfação com a transparência e o ritmo atual. Confirmamos a data da próxima demo.","Atualizações de Projeto"
"Projeto Ni - Decisão Tecnologia Backend: Reunião decisiva sobre a tecnologia a ser utilizada no backend do Projeto Ni. Comparamos as opções pré-selecionadas (Node.js vs. Python/Django) com base em critérios como performance, escalabilidade, curva de aprendizado da equipe e ecossistema. Após debate e análise dos prós e contras apresentados pela equipe técnica, optamos por seguir com Node.js. A decisão foi documentada e comunicada a todos os envolvidos.","Atualizações de Projeto"
"Projeto Ômicron - Revisão Orçamento: Revisamos o orçamento executado do Projeto Ômicron até o momento, comparando-o com o planejado. Identificamos um desvio nos custos de licenciamento de software, que foi maior que o previsto. Analisamos as causas e discutimos formas de compensar em outras rubricas, como otimização de custos de infraestrutura na nuvem. O gerente financeiro apresentará um plano de ajuste na próxima semana.","Atualizações de Projeto"
"Projeto Pi - Estratégia Comunicação: Alinhamos a estratégia de comunicação para o lançamento do Projeto Pi (novo produto). Definimos as mensagens chave, o público-alvo para cada fase da comunicação (pré-lançamento, lançamento, pós-lançamento) e os canais a serem utilizados (redes sociais, email marketing, press release, blog). Atribuímos responsabilidades para a criação dos materiais e estabelecemos um cronograma para as ações de comunicação.","Atualizações de Projeto"
"Projeto Rho - Ajustes Escopo: Discutimos a necessidade de ajustes no escopo do Projeto Rho devido a limitações técnicas descobertas recentemente. Avaliamos quais funcionalidades poderiam ser simplificadas ou adiadas para uma fase posterior sem comprometer o valor central do produto. Priorizamos os requisitos essenciais e documentamos as mudanças no escopo. O Product Owner comunicará as alterações aos stakeholders para realinhamento de expectativas.","Atualizações de Projeto"
"Projeto Teta - Testes Usabilidade: Apresentamos os resultados detalhados da fase de testes de usabilidade do Projeto Teta, que envolveu 10 usuários finais. Identificamos três problemas principais de usabilidade relacionados ao fluxo de cadastro e à busca de informações. Discutimos as recomendações da equipe de UX para solucionar esses pontos. Aprovamos as mudanças propostas e a equipe de desenvolvimento as incluirá na próxima sprint.","Atualizações de Projeto"
"Projeto Ípsilon - Dependência Externa: Focamos em definir os próximos passos para resolver a dependência externa crítica do Projeto Ípsilon (atraso na entrega de hardware pelo fornecedor). Exploramos planos de contingência, como o desenvolvimento utilizando emuladores ou a busca por um fornecedor alternativo. Decidimos manter a pressão sobre o fornecedor atual, mas iniciar conversas com um fornecedor B como backup. Reavaliaremos a situação em 5 dias úteis.","Atualizações de Projeto"
"Projeto Fi - Revisão Pós-Implementação: Realizamos a reunião de revisão pós-implementação da Fase 3 do Projeto Fi. Analisamos o que correu bem (e.g., colaboração da equipe) e o que pode ser melhorado (e.g., processo de deploy). Coletamos feedback sobre a estabilidade da nova versão em produção. Documentamos as lições aprendidas para aplicar em projetos futuros. Os resultados iniciais de performance e adoção foram positivos.","Atualizações de Projeto"
"Projeto Qui - Métricas de Sucesso: Definimos e chegamos a um acordo sobre as métricas de sucesso (KPIs) para o Projeto Qui. Estabelecemos metas claras e mensuráveis para avaliar o impacto do projeto após o lançamento, incluindo taxa de conversão, tempo médio de tarefa e Net Promoter Score (NPS). Discutimos como e com que frequência essas métricas serão monitoradas. O acordo foi documentado e compartilhado.","Atualizações de Projeto"
"Projeto Psi - Brainstorming Solução Técnica: Sessão de brainstorming focada em encontrar soluções para um desafio técnico inesperado encontrado no Projeto Psi (problema de escalabilidade da base de dados). A equipe de arquitetura apresentou o problema em detalhes. Exploramos diversas abordagens, desde otimizações na estrutura atual até a migração para uma tecnologia de banco de dados diferente. Selecionamos duas opções promissoras para prototipagem e teste.","Atualizações de Projeto"
"Projeto Ômega - Contratação Fornecedores: Atualização sobre o status da contratação de fornecedores chave para o Projeto Ômega (Fase 2). Revisamos as propostas recebidas para o serviço de design de interface. Comparamos os portfólios, custos e prazos. Selecionamos o fornecedor A com base na qualidade do trabalho e adequação ao orçamento. O departamento de compras iniciará o processo formal de contratação.","Atualizações de Projeto"
"Projeto Alfa - Confirmação Lançamento: Reunião final de ""go/no-go"" para o lançamento do Projeto Alfa. Revisamos todos os critérios de prontidão: conclusão dos testes, aprovação dos stakeholders, preparação das equipes de suporte e marketing, plano de rollback. Todos os itens estavam conformes. Confirmamos oficialmente a data e hora do lançamento para a próxima terça-feira às 10h. A comunicação final será enviada a todos os envolvidos.","Atualizações de Projeto"
"Pesquisa Comportamento Usuário - Preliminar: A equipe de UX apresentou os resultados preliminares da pesquisa online sobre comportamento do usuário em nosso e-commerce. Os dados indicam que a maioria dos usuários abandona o carrinho na etapa de seleção de frete, citando custos inesperados ou complexidade. Outro achado relevante é a preferência crescente por checkout via carteiras digitais. Discutimos como esses insights podem guiar melhorias na interface e nas opções de pagamento/envio. Próximo passo: análise qualitativa dos comentários.","Achados de Pesquisa"
"Entrevistas Clientes Maio - Insights: Discutimos os insights chave das 15 entrevistas semi-estruturadas com clientes realizadas em Maio. Emergiram temas recorrentes como a necessidade de relatórios mais customizáveis e a dificuldade em encontrar funcionalidades avançadas. Um ponto positivo destacado foi a qualidade do suporte ao cliente. A equipe de produto usará esses feedbacks para priorizar o backlog do próximo trimestre. O relatório completo será compartilhado internamente.","Achados de Pesquisa"
"Teste A/B Campanha Digital - Análise: Analisamos os dados do teste A/B da nova campanha de marketing digital para o Produto X. A versão B do anúncio, com um call-to-action mais direto, apresentou uma taxa de cliques (CTR) 25% superior e uma taxa de conversão 15% maior que a versão A. Decidimos desativar a versão A e alocar o restante do orçamento na versão B. Também discutimos aplicar aprendizados visuais da versão B em outras campanhas.","Achados de Pesquisa"
"Análise Competitiva SaaS - Revisão: Revisamos o relatório trimestral de análise competitiva no setor de SaaS B2B. Identificamos dois novos concorrentes com propostas de valor agressivas focadas em PMEs. Analisamos as estratégias de preço e funcionalidades dos principais players. Discutimos como nosso posicionamento se compara e quais ajustes podem ser necessários em nossa estratégia de produto e marketing para manter a competitividade. A equipe de estratégia definirá ações.","Achados de Pesquisa"
"Tendências IA - Compartilhamento Descobertas: O time de P&D compartilhou descobertas recentes sobre tendências emergentes em inteligência artificial aplicáveis ao nosso negócio. Foco em processamento de linguagem natural (PLN) para melhorar chatbots e análise de sentimento, e visão computacional para automação de processos internos. Avaliamos o potencial de cada tecnologia e selecionamos duas para projetos piloto exploratórios nos próximos seis meses. Responsáveis foram designados para detalhar os pilotos.","Achados de Pesquisa"
"Pesquisa CSAT Q2 - Resultados: Apresentamos os resultados da pesquisa de satisfação do cliente (CSAT) referente ao segundo trimestre. O índice geral se manteve estável em 85%, mas observamos uma queda na satisfação relacionada à velocidade da plataforma. Os comentários destacaram lentidão em horários de pico. Discutimos as possíveis causas e a equipe de infraestrutura iniciará uma investigação detalhada. A meta para o Q3 é retornar aos níveis anteriores de satisfação com performance.","Achados de Pesquisa"
"Pesquisa Mercado & Novos Produtos: Debate sobre como aplicar os achados da recente pesquisa de mercado no desenvolvimento de novos produtos. A pesquisa indicou uma forte demanda por soluções de análise de dados em tempo real no nosso nicho. Brainstormamos conceitos de produto que atendam a essa necessidade, considerando nossa expertise atual. Priorizamos duas ideias para desenvolvimento de um business case mais detalhado pela equipe de produto.","Achados de Pesquisa"
"Engajamento Plataforma - Análise Dados: Realizamos uma análise aprofundada dos dados de engajamento na plataforma nos últimos 6 meses. Identificamos que o uso da funcionalidade de colaboração aumentou 30%, mas o módulo de relatórios teve uma queda de 15% no uso. Investigamos correlações com atualizações recentes e feedback de usuários. Formulamos hipóteses para a queda (complexidade, falta de divulgação) e planejamos ações como webinars e tutoriais para reengajar os usuários no módulo de relatórios.","Achados de Pesquisa"
"Estudo Viabilidade Expansão - Resultados: Apresentamos os resultados do estudo de viabilidade para expansão para o mercado latino-americano. A análise incluiu tamanho de mercado, concorrência local, requisitos regulatórios e culturais. O estudo concluiu que Brasil e México apresentam o maior potencial, mas exigem adaptação significativa do produto e estratégia de go-to-market. Recomendou-se iniciar com um piloto focado no Brasil. A diretoria tomará a decisão final baseada no relatório.","Achados de Pesquisa"
"Análise Logs Acesso - Padrões: Discutimos os padrões identificados na análise de logs de acesso ao sistema do último mês. Observamos um aumento significativo de tentativas de login malsucedidas de determinadas faixas de IP, sugerindo possíveis ataques de força bruta. Também identificamos erros frequentes em uma chamada específica de API interna. Decidimos implementar um bloqueio de IP mais agressivo e priorizar a correção do erro na API na próxima sprint.","Achados de Pesquisa"
"Métricas Campanha Mídia Social - Revisão: Revisamos as métricas de performance da última campanha de mídia social no LinkedIn e Instagram. A campanha no LinkedIn gerou mais leads qualificados, apesar de um custo por clique maior. O engajamento (curtidas, comentários) foi maior no Instagram, mas com menor conversão. Decidimos ajustar a alocação de orçamento, priorizando o LinkedIn para geração de leads B2B e usando o Instagram mais para branding. Próxima campanha incorporará esses aprendizados.","Achados de Pesquisa"
"Pesquisa Clima Organizacional - Apresentação: O RH apresentou os resultados consolidados da pesquisa anual de clima organizacional. Os pontos fortes destacados foram o bom relacionamento entre colegas e o orgulho de pertencer à empresa. As áreas de melhoria apontadas incluem comunicação interdepartamental e oportunidades de desenvolvimento de carreira. A diretoria e os gestores discutirão planos de ação específicos para cada área nos próximos workshops.","Achados de Pesquisa"
"Dados Demográficos Novos Usuários - Análise: Analisamos os dados demográficos dos novos usuários cadastrados na plataforma nos últimos três meses. Observamos um aumento na faixa etária de 25-34 anos e uma maior concentração em áreas metropolitanas. Cruzamos esses dados com as fontes de aquisição, notando que campanhas de marketing de influência atraíram um público mais jovem. Discutimos como refinar a segmentação de nossas campanhas futuras com base nesses dados.","Achados de Pesquisa"
"Focus Group Novo Serviço - Resultados: Discutimos os resultados do focus group realizado na semana passada para validar um novo conceito de serviço premium. O feedback geral foi positivo quanto à proposta de valor, mas houve preocupações sobre o preço e a clareza de alguns benefícios. Os participantes sugeriram nomes alternativos e funcionalidades adicionais. A equipe de produto usará esses insights para refinar o conceito e a estratégia de precificação antes de um teste piloto.","Achados de Pesquisa"
"Feedback App Store - Aprendizados: Compartilhamos os principais aprendizados da análise sistemática do feedback dos usuários nas app stores (iOS e Android) do último mês. As reclamações mais frequentes foram sobre bugs na versão Android após a última atualização e pedidos por um modo escuro. As avaliações positivas elogiaram a nova funcionalidade de busca. Priorizamos a correção dos bugs do Android e adicionamos o modo escuro ao backlog.","Achados de Pesquisa"
"Onboarding Clientes - Eficácia Dados: Apresentamos dados sobre a eficácia do novo processo de onboarding de clientes implementado no Q1. Métricas como tempo para primeira utilização chave e taxa de conclusão do tutorial melhoraram em 20%. No entanto, o número de chamados de suporte nos primeiros 30 dias não diminuiu como esperado. Discutimos possíveis ajustes no conteúdo do onboarding para abordar as dúvidas mais frequentes que ainda geram chamados.","Achados de Pesquisa"
"Tendências Busca - Análise: Analisamos as tendências de busca no Google relacionadas aos nossos produtos e ao nosso setor nos últimos seis meses. Identificamos um aumento na busca por termos relacionados a ""automação de fluxo de trabalho"" e ""integração de sistemas"". Isso valida nossa direção estratégica. Também notamos um concorrente ganhando visibilidade em buscas por termos chave. Decidimos reforçar nossa estratégia de SEO e conteúdo para esses termos.","Achados de Pesquisa"
"Pesquisa Segmentação Mercado - Discussão: Discutimos os resultados da pesquisa de segmentação de mercado recém-concluída. Identificamos cinco segmentos distintos de clientes com necessidades e comportamentos diferentes. Analisamos o tamanho e o potencial de cada segmento. Decidimos focar nossas ações de marketing e vendas nos dois segmentos mais promissores (PMEs de tecnologia e grandes empresas de varejo) no próximo ano, adaptando a mensagem para cada um.","Achados de Pesquisa"
"Monitoramento Marca Online - Relatório: Revisamos o relatório mensal de monitoramento de menções da marca online (redes sociais, fóruns, notícias). O sentimento geral permanece positivo, mas houve um pico de menções neutras/negativas relacionadas a uma instabilidade recente na plataforma. Respondemos publicamente às principais reclamações. Discutimos a importância de uma comunicação proativa durante incidentes e como melhorar nosso tempo de resposta.","Achados de Pesquisa"
"Dados Vendas por Região - Análise Comparativa: Apresentamos uma análise comparativa dos dados de vendas por região nos últimos dois trimestres. A região Sudeste continua sendo a mais forte, mas a região Nordeste mostrou o maior crescimento percentual (35%). A região Sul apresentou uma leve queda. Discutimos possíveis fatores (ações de marketing localizadas, performance da equipe de vendas, concorrência regional) e planejamos ações específicas para impulsionar as vendas na região Sul.","Achados de Pesquisa"
"Responsabilidades Q3 - Revisão Equipe: Revisamos e ajustamos as responsabilidades da equipe de desenvolvimento para o próximo trimestre (Q3). Com a entrada de dois novos projetos, redistribuímos algumas tarefas e definimos novos líderes técnicos para cada iniciativa. Esclarecemos as expectativas de cada papel e garantimos que a carga de trabalho esteja equilibrada. Atualizamos a matriz de responsabilidades (RACI) e a compartilhamos com todos.","Gestão de Equipe"
"Distribuição Tarefas Projeto Delta: Realizamos uma reunião específica para alinhar a distribuição de tarefas para o recém-iniciado Projeto Delta. Com base nas habilidades e na carga de trabalho atual de cada membro, atribuímos os pacotes de trabalho iniciais. Utilizamos um quadro Kanban virtual para visualizar as tarefas e responsáveis. Estabelecemos checkpoints semanais para acompanhar o progresso e rebalancear se necessário. Todos confirmaram entendimento de suas atribuições.","Gestão de Equipe"
"Carga Trabalho & Priorização: Discutimos abertamente a carga de trabalho atual da equipe de marketing, que relatou sentir-se sobrecarregada. Revisamos a lista de projetos e campanhas em andamento e no backlog. Realizamos um exercício de priorização forçada (MoSCoW) para identificar o que é essencial (Must have) versus desejável (Should have, Could have). Decidimos adiar duas iniciativas menos críticas para aliviar a pressão imediata.","Gestão de Equipe"
"Metas OKRs Q3 - Revisão Progresso: Fizemos a revisão de meio de trimestre das metas (OKRs) da equipe de suporte. Avaliamos o progresso em relação a cada Key Result estabelecido. Celebramos os avanços no KR de redução do tempo de primeira resposta. Identificamos que o KR de aumento da base de conhecimento está um pouco atrasado. Discutimos os obstáculos e definimos ações corretivas, como dedicar blocos de tempo específicos para a criação de artigos.","Gestão de Equipe"
"Programa Treinamento Ferramentas Gestão: Planejamos o programa de treinamento interno sobre as novas ferramentas de gestão de projetos (Asana/Jira) que serão adotadas. Definimos o público-alvo, o conteúdo (desde o básico até funcionalidades avançadas), o formato (sessões online ao vivo + gravações) e o cronograma. Designamos instrutores internos e preparamos materiais de apoio. A comunicação sobre o treinamento será enviada na próxima semana.","Gestão de Equipe"
"Feedback 360 Graus - Definição Processo: Definimos o processo para a implementação do ciclo de feedback 360 graus na equipe de liderança. Discutimos os objetivos (desenvolvimento, não avaliação de performance), a ferramenta a ser utilizada, o cronograma, as competências a serem avaliadas e o processo de comunicação e treinamento para os participantes. Enfatizamos a confidencialidade e o uso construtivo do feedback. O piloto iniciará no próximo mês.","Gestão de Equipe"
