text,category
"Ferramenta Interna Hydra - Coleta de Feedback de Usuários Piloto: Reunião com os usuários piloto da nova ferramenta interna Hydra. Coletamos feedback sobre a usabilidade, funcionalidades e bugs encontrados. As sugestões foram registradas e serão priorizadas pela equipe de desenvolvimento da ferramenta.","Atualizações de Projeto"
"Projeto Cygnus - Gestão de Mudanças (Change Request): Analisamos uma solicitação de mudança (change request) submetida pelo stakeholder principal do Projeto Cygnus, que impacta o escopo e o cronograma. Avaliamos o impacto e o esforço adicional. Aprovamos a mudança com ajuste no prazo final de entrega.","Atualizações de Projeto"
"Módulo Vulpecula - Testes de Integração: A equipe de QA apresentou o status dos testes de integração do Módulo Vulpecula com outros componentes do sistema. Identificamos algumas falhas na comunicação entre serviços, que serão investigadas pelos desenvolvedores responsáveis. Um novo ciclo de testes será executado após as correções.","Atualizações de Projeto"
"Projeto Tucana - Planejamento de Rollback: Como parte do planejamento de implantação do Projeto Tucana, definimos um plano de rollback detalhado caso ocorram problemas críticos pós-lançamento. Identificamos os passos, responsáveis e o tempo estimado para reverter ao estado anterior.","Atualizações de Projeto"
"Sistema Indus - Revisão de Requisitos Não Funcionais: Revisamos os requisitos não funcionais (performance, escalabilidade, disponibilidade) do Sistema Indus antes de iniciar a fase de desenvolvimento. Garantimos que os critérios de aceitação estão claros e mensuráveis.","Atualizações de Projeto"
"Projeto Grus - Acompanhamento de Fornecedor: Reunião com o fornecedor da API de pagamentos do Projeto Grus para discutir atrasos na liberação de novas funcionalidades essenciais. Cobramos um novo prazo e um plano de contingência por parte do fornecedor.","Atualizações de Projeto"
"Plataforma Octans - Definição de SLAs: A equipe de operações e desenvolvimento definiu os Acordos de Nível de Serviço (SLAs) para os diferentes módulos da Plataforma Octans, incluindo tempo de resposta e disponibilidade. Estes SLAs serão comunicados aos clientes.","Atualizações de Projeto"
"Projeto Pavo - Brainstorming de Soluções para Usabilidade: Sessão de brainstorming com a equipe de UX e desenvolvimento para encontrar soluções para os problemas de usabilidade identificados nos testes do Projeto Pavo. Priorizamos as soluções de maior impacto e menor esforço para implementação imediata.","Atualizações de Projeto"
"Aplicativo Apus - Estratégia de Testes Mobile: Definimos a estratégia de testes para o Aplicativo Apus, cobrindo testes em diferentes dispositivos (iOS e Android), versões de SO e condições de rede. A equipe de QA ficou responsável por detalhar os casos de teste.","Atualizações de Projeto"
"Projeto Ara - Alinhamento com Stakeholders sobre Atraso: Comunicamos aos stakeholders do Projeto Ara sobre um atraso inevitável devido a um problema técnico complexo. Apresentamos o novo cronograma e as ações para mitigar impactos futuros.","Atualizações de Projeto"
"Módulo Telescopium - Refinamento de User Stories: O Product Owner e a equipe de desenvolvimento refinaram as user stories para o próximo conjunto de funcionalidades do Módulo Telescopium. Esclarecemos dúvidas, adicionamos critérios de aceitação e estimamos o esforço.","Atualizações de Projeto"
"Projeto Corona - Lições Aprendidas da Fase 1: Realizamos uma sessão de lições aprendidas após a conclusão da Fase 1 do Projeto Corona. Documentamos o que funcionou bem, os desafios enfrentados e as melhorias para as próximas fases.","Atualizações de Projeto"
"Sistema Horologium - Demonstração de Prova de Conceito (PoC): A equipe de inovação apresentou uma demonstração da Prova de Conceito (PoC) para uma nova tecnologia de busca no Sistema Horologium. Os resultados foram promissores e aprovamos o desenvolvimento de um protótipo funcional.","Atualizações de Projeto"
"Projeto Pictor - Seleção de Ferramenta de Automação: Comparamos diferentes ferramentas de automação de testes para o Projeto Pictor. Avaliamos custos, curva de aprendizado e integração com nosso ambiente. Decidimos pela ferramenta X e planejamos um treinamento para a equipe.","Atualizações de Projeto"
"Plataforma Volans - Capacidade do Servidor: Analisamos o consumo de recursos e a capacidade dos servidores da Plataforma Volans, projetando o crescimento para os próximos 6 meses. Decidimos provisionar novos servidores para garantir a escalabilidade.","Atualizações de Projeto"
"Projeto Dorado - Acompanhamento de Riscos de Terceiros: Revisamos os riscos associados aos componentes de terceiros utilizados no Projeto Dorado. Verificamos se há atualizações de segurança pendentes ou vulnerabilidades conhecidas que precisam ser tratadas.","Atualizações de Projeto"
"Aplicativo Mensa - Plano de Comunicação de Lançamento: Definimos o plano de comunicação interna e externa para o lançamento do Aplicativo Mensa. Atribuímos responsabilidades para a criação de materiais de marketing e comunicados.","Atualizações de Projeto"
"Projeto Reticulum - Revisão de Código em Pares: Instituímos uma sessão semanal de revisão de código em pares (pair code review) para o Projeto Reticulum, visando melhorar a qualidade do código e compartilhar conhecimento entre os desenvolvedores.","Atualizações de Projeto"
"Módulo Caelum - Priorização de Correção de Bugs: O time de produto e QA se reuniu para priorizar a lista de bugs reportados para o Módulo Caelum. Classificamos os bugs por severidade e impacto no usuário para definir a ordem de correção.","Atualizações de Projeto"
"Pesquisa de Satisfação com Suporte Técnico - Análise Trimestral: Analisamos os resultados da pesquisa trimestral de satisfação com o suporte técnico. Identificamos que o tempo de resolução de chamados complexos é um ponto de dor. Discutimos a criação de um time de Nível 3 especializado.","Achados de Pesquisa"
"Estudo de Jornada do Usuário - E-commerce: Apresentação dos mapas de jornada do usuário para o processo de compra no nosso e-commerce. Foram identificados pontos de atrito na etapa de cadastro e sugestões de melhoria para o fluxo de checkout. A equipe de UX irá propor alterações no design.","Achados de Pesquisa"
"Análise de Sentimento em Redes Sociais - Lançamento Produto Z: Compartilhamos a análise de sentimento das menções ao novo Produto Z nas redes sociais durante a primeira semana de lançamento. O sentimento geral é positivo, mas surgiram dúvidas sobre a funcionalidade X. Planejamos criar um FAQ e tutoriais.","Achados de Pesquisa"
"Benchmarking de Funcionalidades - Concorrente Principal: Revisamos um estudo de benchmarking focado nas funcionalidades do nosso principal concorrente em relação à nossa plataforma. Identificamos 3 funcionalidades chave que eles possuem e nós não, e que são altamente valorizadas pelos clientes. Produto avaliará a inclusão no roadmap.","Achados de Pesquisa"
"Teste de Usabilidade Nova Dashboard - Resultados e Recomendações: Apresentação dos resultados do teste de usabilidade da nova dashboard. Os usuários tiveram dificuldade em encontrar os filtros avançados. Recomendamos tornar os filtros mais visíveis e adicionar um tour guiado.","Achados de Pesquisa"
"Análise de Dados de Adoção - Feature Y: Investigamos os dados de adoção da Feature Y, lançada há 2 meses. A taxa de adoção está abaixo do esperado (15% vs meta de 40%). Formulamos hipóteses (falta de divulgação, complexidade) e planejamos uma campanha de e-mail marketing e webinars.","Achados de Pesquisa"
"Pesquisa Quantitativa sobre Preferências de Comunicação: Resultados da pesquisa com clientes sobre seus canais de comunicação preferidos para receber novidades e suporte. E-mail e chat se destacaram. Vamos reavaliar o uso de SMS para comunicados.","Achados de Pesquisa"
"Análise de Tráfego do Blog - Últimos 6 Meses: Analisamos as fontes de tráfego, posts mais lidos e taxas de conversão do blog nos últimos 6 meses. Identificamos que posts sobre ""melhores práticas"" geram mais leads. Decidimos focar mais nesse tipo de conteúdo.","Achados de Pesquisa"
"Entrevistas de Saída (Ex-clientes) - Padrões Identificados: Apresentamos os padrões identificados nas entrevistas de saída com clientes que cancelaram o serviço no último trimestre. Preço e falta de uma integração específica foram os motivos mais citados. A equipe de produto e vendas discutirá ações.","Achados de Pesquisa"
"Teste de Conceito - Nova Ferramenta de Colaboração: Resultados do teste de conceito para uma nova ferramenta de colaboração interna. O interesse foi alto, mas houve preocupações sobre a curva de aprendizado. Planejamos simplificar a interface antes de um piloto.","Achados de Pesquisa"
"Análise de Performance de Landing Pages - Campanha de Fim de Ano: Revisamos a performance das landing pages da campanha de fim de ano. A LP com vídeo teve uma taxa de conversão 30% maior. Vamos priorizar vídeos em futuras LPs.","Achados de Pesquisa"
"Pesquisa de Necessidades de Treinamento Interno: O RH apresentou os resultados de uma pesquisa interna sobre as necessidades de treinamento. As áreas mais solicitadas foram liderança, gestão de tempo e ferramentas de análise de dados. Um plano de treinamento será elaborado.","Achados de Pesquisa"
"Estudo de Precificação - Mercado de Software Educacional: Apresentamos um estudo comparativo de modelos de precificação no mercado de software educacional. Analisamos concorrentes diretos e indiretos para embasar a definição de preço do nosso novo produto para este segmento.","Achados de Pesquisa"
"Análise de Funil de Vendas - Identificação de Gargalos: A equipe de vendas e marketing analisou o funil de vendas, identificando um gargalo na conversão de MQL para SQL. Discutimos a necessidade de melhorar a qualificação dos leads e o alinhamento entre as equipes.","Achados de Pesquisa"
"Feedback de Beta Testers - App Mobile V2: Consolidamos e discutimos o feedback dos beta testers da versão 2 do nosso aplicativo mobile. Os principais pontos foram a melhoria na navegação e a solicitação de um modo offline. As sugestões serão avaliadas para o lançamento.","Achados de Pesquisa"
"Pesquisa de Percepção de Marca - Pós-Rebranding: Apresentamos os resultados da pesquisa de percepção de marca realizada 3 meses após o rebranding. A nova identidade visual foi bem recebida e associada a modernidade, mas o reconhecimento do novo logo ainda precisa ser trabalhado.","Achados de Pesquisa"
"Análise de Logs de Erro da Aplicação - Tendências: O time de SRE apresentou uma análise das tendências nos logs de erro da aplicação principal. Identificamos um aumento de erros de timeout em uma API específica, que será investigado pela equipe de backend.","Achados de Pesquisa"
"Estudo Etnográfico - Rotina de Profissionais de Marketing: A equipe de UX compartilhou os achados de um estudo etnográfico observando a rotina de profissionais de marketing. Os insights ajudarão a refinar as personas e a identificar necessidades não atendidas para futuros produtos.","Achados de Pesquisa"
"Análise de Causa Raiz - Queda de Vendas Produto X: Investigamos as possíveis causas para a queda nas vendas do Produto X no último mês. Fatores como sazonalidade e aumento da atividade de um concorrente foram considerados. Planejamos uma campanha promocional.","Achados de Pesquisa"
"Pesquisa de Canais de Aquisição - Custo por Lead: Apresentamos uma análise do custo por lead (CPL) de cada canal de aquisição. Links patrocinados têm o menor CPL, mas eventos têm o maior LTV. Discutimos a otimização do mix de canais.","Achados de Pesquisa"
"Revisão de Competências da Equipe de Dados: Mapeamos as competências atuais da equipe de ciência de dados e identificamos GAPs em relação às necessidades futuras (e.g., MLOps). Planejamos um programa de capacitação e a contratação de um especialista.","Gestão de Equipe"
"Alinhamento sobre Processo de Avaliação de Desempenho: Os gestores se reuniram para alinhar o processo e os critérios para o próximo ciclo de avaliação de desempenho. Discutimos a importância da calibração e do feedback construtivo.","Gestão de Equipe"
"Planejamento de Sucessão para Posições Chave: A diretoria discutiu o planejamento de sucessão para posições de liderança chave na empresa, identificando potenciais sucessores internos e planos de desenvolvimento.","Gestão de Equipe"
"Workshop sobre Comunicação Não-Violenta: Realizamos um workshop para todas as equipes sobre princípios e práticas de Comunicação Não-Violenta, visando melhorar a colaboração e a resolução de conflitos.","Gestão de Equipe"
"Definição de Metas de Contratação para Q4: O RH e os líderes de departamento definiram as metas de contratação para o Q4, priorizando as vagas mais críticas para os objetivos da empresa.","Gestão de Equipe"
"Revisão da Política de Benefícios: O comitê de benefícios revisou a política atual, considerando feedback dos colaboradores e tendências de mercado. Algumas propostas de novos benefícios (auxílio creche, day-off no aniversário) serão levadas à diretoria.","Gestão de Equipe"
"Programa de Reconhecimento de Talentos - Lançamento: Lançamos o novo programa de reconhecimento de talentos, que premiará colaboradores com base em performance e contribuições para a cultura da empresa. Explicamos os critérios e o processo de nomeação.","Gestão de Equipe"
"Onboarding de Novos Representantes de Vendas: Sessão de boas-vindas e primeira semana de onboarding para os novos representantes de vendas. Apresentamos a cultura, produtos, processos de vendas e metas.","Gestão de Equipe"
"Discussão sobre Diversidade e Inclusão na Contratação: O comitê de D&I e o RH discutiram estratégias para aumentar a diversidade nos processos de recrutamento, como revisão de descrições de vagas e parceria com grupos minoritários.","Gestão de Equipe"
"Feedback sobre Programa de Mentoria Piloto: Coletamos feedback dos participantes do programa de mentoria piloto. Os resultados foram positivos, e decidimos expandir o programa para mais equipes no próximo semestre.","Gestão de Equipe"
"Treinamento em Gerenciamento de Projetos para Líderes Técnicos: Iniciamos um ciclo de treinamento em gerenciamento de projetos para os líderes técnicos, focando em planejamento, execução e monitoramento de projetos ágeis.","Gestão de Equipe"
"Alocação de Desenvolvedores para Novos Projetos: Discutimos a alocação de desenvolvedores sênior e júnior para os três novos projetos que iniciarão no próximo mês, buscando equilibrar experiência e oportunidades de desenvolvimento.","Gestão de Equipe"
"Revisão de Salários e Cargos (Benchmarking): O RH apresentou um estudo de benchmarking de salários e cargos em comparação com o mercado. Discutimos possíveis ajustes para garantir a competitividade na retenção de talentos.","Gestão de Equipe"
"Planejamento de Evento de Integração Semestral: A equipe de RH e voluntários planejaram o evento de integração semestral, definindo tema, atividades, local e orçamento. O foco será em atividades ao ar livre e colaborativas.","Gestão de Equipe"
"Gestão de Conflitos Interpessoais no Time X: Reunião com o gestor do Time X para discutir e mediar um conflito interpessoal entre dois membros. Facilitamos a conversa e estabelecemos acordos para melhorar a comunicação.","Gestão de Equipe"
"Definição de Plano de Carreira para Analistas de Suporte: O líder de suporte e o RH trabalharam na definição de um plano de carreira claro para os analistas de suporte, com trilhas de desenvolvimento técnico e de gestão.","Gestão de Equipe"
"Atualização sobre Processos de Desligamento (Offboarding): O RH comunicou atualizações no processo de desligamento, incluindo entrevistas de saída mais estruturadas e checklist de devolução de equipamentos e acessos.","Gestão de Equipe"
"Workshop de Liderança para Novos Gestores: Realizamos o primeiro módulo do workshop de desenvolvimento de liderança para gestores recém-promovidos, focando em feedback, delegação e motivação de equipes.","Gestão de Equipe"
"Revisão da Estrutura de Guildas Técnicas: Avaliamos a efetividade da atual estrutura de guildas técnicas (Front-end, Backend, QA). Decidimos criar uma nova guilda de DevOps e fortalecer a liderança das guildas existentes.","Gestão de Equipe"
"Acompanhamento de Metas de Bem-Estar da Equipe: O comitê de bem-estar revisou o progresso das metas, como adesão ao programa de ginástica laboral e participação nas pausas ativas. Planejamos novas ações para incentivar a participação.","Gestão de Equipe"
"Cliente CorpGlobal - Kick-off Projeto de Consultoria em Transformação Digital: Reunião inicial com a CorpGlobal para o projeto de consultoria. Apresentamos a equipe, metodologia, cronograma macro e alinhamos expectativas sobre os entregáveis e a comunicação.","Reuniões com Clientes"
"Cliente InovaTech - Apresentação da Proposta de Solução Personalizada: Demonstramos ao Cliente InovaTech como nossa solução personalizada de IA pode otimizar seus processos de análise de dados. O cliente solicitou ajustes na proposta e um piloto.","Reuniões com Clientes"
"Cliente BetaSoluções - Treinamento Avançado em Módulo Financeiro: Ministramos um treinamento avançado para os usuários chave do Cliente BetaSoluções no módulo financeiro da nossa plataforma, cobrindo relatórios customizados e conciliação.","Reuniões com Clientes"
"Cliente AlphaLog - Discussão sobre Renovação Contratual e Upsell: Discutimos com o Cliente AlphaLog os termos para renovação do contrato e apresentamos uma proposta de upsell para o nosso novo módulo de logística preditiva. O cliente demonstrou interesse.","Reuniões com Clientes"
"Cliente GammaFoods - Resolução de Escalada Crítica de Suporte: Reunião de emergência com o Cliente GammaFoods para tratar de uma escalada crítica relacionada à instabilidade da plataforma. Apresentamos o plano de ação e o prazo para normalização.","Reuniões com Clientes"
"Cliente DeltaRetail - Revisão de Progresso (QBR) e Planejamento Q3: Realizamos a QBR com o Cliente DeltaRetail, apresentando os resultados do Q2 e discutindo as prioridades e metas conjuntas para o Q3, incluindo a expansão para novas lojas.","Reuniões com Clientes"
"Cliente EpsilonEdu - Coleta de Requisitos para Portal do Aluno: Sessão com o Cliente EpsilonEdu para levantar os requisitos detalhados para o desenvolvimento do novo portal do aluno. Mapeamos funcionalidades, fluxos e integrações necessárias.","Reuniões com Clientes"
"Cliente ZetaHealth - Demonstração de Conformidade com HIPAA: Apresentamos ao Cliente ZetaHealth as funcionalidades e processos da nossa plataforma que garantem a conformidade com as regulações de privacidade de dados de saúde (HIPAA).","Reuniões com Clientes"
"Cliente EtaServices - Feedback sobre Implementação da API: Coletamos feedback do Cliente EtaServices sobre a recente implementação da nossa API em seus sistemas. Identificamos pontos de melhoria na documentação e exemplos de código.","Reuniões com Clientes"
"Cliente ThetaBank - Apresentação de Estudo de ROI: Apresentamos ao Cliente ThetaBank um estudo de ROI detalhado, demonstrando os ganhos financeiros e de eficiência obtidos com a utilização da nossa solução nos últimos 12 meses.","Reuniões com Clientes"
"Cliente IotaEnergy - Negociação de Aditivo Contratual para Novas Funcionalidades: Negociamos com o Cliente IotaEnergy um aditivo contratual para o desenvolvimento de novas funcionalidades específicas para o setor de energia, não previstas no escopo original.","Reuniões com Clientes"
"Cliente KappaMotors - Workshop de Design Thinking para Novo App: Facilitamos um workshop de Design Thinking com a equipe do Cliente KappaMotors para cocriar o conceito e as funcionalidades de um novo aplicativo para seus clientes.","Reuniões com Clientes"
"Cliente LambdaGov - Alinhamento de Prazos para Entrega de Relatórios Regulatórios: Alinhamos com o Cliente LambdaGov os prazos e formatos para a entrega dos relatórios regulatórios gerados por nossa plataforma, garantindo o cumprimento das exigências legais.","Reuniões com Clientes"
"Cliente MuIndústria - Apresentação de Prova de Conceito (PoC) de IoT: Demonstramos ao Cliente MuIndústria uma PoC de como nossa plataforma de IoT pode monitorar e otimizar o consumo de energia em suas fábricas. O cliente aprovou o início de um projeto piloto.","Reuniões com Clientes"
"Cliente NuFarma - Discussão sobre Integração com Sistema de Prescrição Eletrônica: Reunião técnica com o Cliente NuFarma para discutir os requisitos e desafios da integração da nossa plataforma com o sistema de prescrição eletrônica utilizado por eles.","Reuniões com Clientes"
"Cliente XiComunicações - Acompanhamento Pós-Go Live e Suporte: Reunião de acompanhamento com o Cliente XiComunicações uma semana após o go-live da nova plataforma. Verificamos a estabilidade, coletamos feedback inicial e alinhamos o suporte contínuo.","Reuniões com Clientes"
"Cliente OmicronFin - Solicitação de Customização de Dashboard: O Cliente OmicronFin solicitou a customização da dashboard principal da plataforma, adicionando novos KPIs e gráficos específicos para sua área de análise de risco. Avaliaremos a viabilidade.","Reuniões com Clientes"
"Cliente PiTransportes - Treinamento de Reciclagem para Equipe de Logística: Ministramos um treinamento de reciclagem para a equipe de logística do Cliente PiTransportes, focando nas novas funcionalidades do módulo de roteirização e rastreamento.","Reuniões com Clientes"
"Cliente RhoManufacturing - Análise de Performance e Otimização de Processos: Conduzimos uma análise de performance da nossa solução no ambiente do Cliente RhoManufacturing e propusemos otimizações de processos para maximizar o uso da ferramenta.","Reuniões com Clientes"
"Cliente SigmaAgro - Apresentação de Solução para Agricultura de Precisão: Apresentamos ao Cliente SigmaAgro como nossa solução de análise de dados e sensores pode ser aplicada à agricultura de precisão, melhorando a produtividade e reduzindo custos.","Reuniões com Clientes"
"Planejamento de Evento Anual de Usuários: O comitê organizador se reuniu para iniciar o planejamento do evento anual de usuários. Definimos data preliminar, local, temas principais e orçamento inicial. Próximo passo: convidar palestrantes.","Outras"
"Revisão da Estratégia de Marketing de Conteúdo: A equipe de marketing revisou a estratégia de conteúdo para o próximo semestre, analisando a performance dos canais e formatos atuais. Decidimos investir mais em vídeos curtos e webinars.","Outras"
"Alinhamento de Metas entre Vendas e Produto: Líderes de Vendas e Produto se reuniram para alinhar metas e expectativas para o próximo lançamento de produto, garantindo que a mensagem de vendas esteja alinhada com as funcionalidades entregues.","Outras"
"Discussão sobre Parceria com Universidade para P&D: A equipe de inovação e o jurídico discutiram os termos de uma possível parceria com uma universidade local para projetos de pesquisa e desenvolvimento em Inteligência Artificial.","Outras"
"Atualização do Plano de Resposta a Incidentes Cibernéticos: O comitê de segurança da informação atualizou o plano de resposta a incidentes cibernéticos, incorporando aprendizados de simulações recentes e novas ameaças.","Outras"
"Brainstorming para Nome de Novo Produto SaaS: Equipes de marketing, produto e vendas participaram de um brainstorming para gerar nomes para o novo produto SaaS que será lançado no Q4. Selecionamos 5 nomes para teste de mercado.","Outras"
"Definição de Política de Uso de Software Open Source: O jurídico e a equipe de arquitetura definiram uma política clara para o uso de componentes de software open source nos produtos da empresa, incluindo critérios de licenciamento e segurança.","Outras"
"Reunião com Investidores - Apresentação de Resultados Semestrais: A diretoria apresentou os resultados financeiros e operacionais do primeiro semestre aos investidores, destacando o crescimento e os planos para o futuro.","Outras"
"Seleção de Fornecedor para Nova Plataforma de E-learning: O comitê de T&D avaliou as propostas de três fornecedores para uma nova plataforma de e-learning interna. Decidimos pelo Fornecedor B com base na usabilidade e custo-benefício.","Outras"
"Planejamento de Ações de Responsabilidade Social para Fim de Ano: O grupo de voluntariado corporativo planejou as ações de responsabilidade social para o fim de ano, incluindo arrecadação de alimentos e doação de brinquedos para instituições de caridade.","Outras"
"Workshop sobre Lei Geral de Proteção de Dados (LGPD) para Marketing: A equipe de marketing participou de um workshop sobre as implicações da LGPD em suas atividades, como coleta de dados, consentimento e e-mail marketing.","Outras"
"Revisão do Processo de Compras e Aquisições: O departamento financeiro e de compras revisou o processo de aquisição de bens e serviços, buscando maior agilidade e controle de custos. Propostas de melhoria foram documentadas.","Outras"
"Discussão sobre Adoção de Nova Metodologia de Gestão de Portfólio: A liderança discutiu a adoção de uma nova metodologia para gestão do portfólio de projetos da empresa, visando melhor alinhamento estratégico e priorização de investimentos.","Outras"
